{
  "$schema": "../../schemas/meta.schema.json",
  "id": "2026-06-12-on-policy-sdft-mit-fine-tuning-zero-forgetting",
  "title": "On-Policy SDFT: Stop Catastrophic Forgetting in LLM Fine-Tuning",
  "slug": "on-policy-sdft-mit-fine-tuning-zero-forgetting",
  "created_at": "2026-06-12T03:16:47.479875+00:00",
  "author": "AI Dev Digest",
  "tags": [
    "LLM Fine-Tuning",
    "SDFT",
    "Machine Learning",
    "QLoRA"
  ],
  "excerpt": "MIT and ETH Zurich's new On-Policy Self-Distillation Fine-Tuning (SDFT) prevents catastrophic forgetting in LLMs by utilizing an elegant, in-context teacher-student loop.",
  "hero_image": "assets/hero.jpg"
}
