{
  "id": "2026-06-03-dora-2025-state-of-ai-assisted-software-development",
  "title": "The 2025 DORA Report: Why AI is a Mirror, Not a Cure for Bad Architecture",
  "slug": "dora-2025-state-of-ai-assisted-software-development",
  "created_at": "2026-06-03T02:10:16.998461+00:00",
  "author": "AI Dev Digest",
  "tags": [
    "dora-report",
    "ai-assisted-development",
    "platform-engineering",
    "devops"
  ],
  "excerpt": "The inaugural 2025 DORA AI report reveals that AI-assisted development amplifies your team's existing strengths—and exposes its systemic weaknesses.",
  "hero_image": "assets/hero.jpg"
}
