{
  "$schema": "../../schemas/meta.schema.json",
  "id": "2026-06-10-infoq-twenty-years-ai-native-engineering",
  "title": "InfoQ at 20: Navigating the Shift to AI-Native Engineering and Agentic Workflows",
  "slug": "infoq-twenty-years-ai-native-engineering",
  "created_at": "2026-06-10T03:15:16.374805+00:00",
  "author": "AI Dev Digest",
  "tags": [
    "software-architecture",
    "ai-native-engineering",
    "infoq"
  ],
  "excerpt": "To mark its 20th anniversary, InfoQ explores the evolution of the technology adoption curve, shifting focus from code autocompletion to orchestrating agentic multi-agent platforms.",
  "hero_image": "assets/hero.jpg"
}
