{
  "$schema": "../../schemas/meta.schema.json",
  "id": "2026-06-07-dora-roi-ai-engineering-foundations",
  "title": "Why AI Fails Without Strong DevOps: Inside the New DORA Report",
  "slug": "dora-roi-ai-engineering-foundations",
  "created_at": "2026-06-07T12:40:48.538893+00:00",
  "author": "AI Dev Digest",
  "tags": [
    "DevOps",
    "DORA-Metrics",
    "Generative-AI",
    "Software-Architecture"
  ],
  "excerpt": "The new DORA report reveals a fifth core metric and explains why AI-assisted development leads to a productivity dip without robust engineering foundations.",
  "hero_image": "assets/hero.jpg"
}
