{
  "id": "2026-06-03-software-development-2026-tools-trends",
  "title": "Software Development in 2026: Navigating AI Agents, Cloud-Native Toolchains, and DevOps Automation",
  "slug": "software-development-2026-tools-trends",
  "created_at": "2026-06-03T04:30:56.074510+00:00",
  "author": "AI Dev Digest",
  "tags": [
    "software-engineering",
    "ai-development",
    "cloud-native",
    "devops",
    "refonte-learning"
  ],
  "excerpt": "Explore how AI-augmented development, agentic workflows, and cloud-native toolchains are transforming the software engineering landscape in 2026.",
  "hero_image": "assets/hero.jpg"
}
