[
  {
    "id": "2026-06-05-6-best-vector-databases-ai-apps-2026",
    "title": "6 Best Vector Databases for AI Apps in 2026",
    "slug": "6-best-vector-databases-ai-apps-2026",
    "created_at": "2026-06-05T03:16:58.771619+00:00",
    "author": "AI Dev Digest",
    "tags": [
      "vector-databases",
      "ai-infrastructure",
      "machine-learning",
      "rag-stack"
    ],
    "excerpt": "Compare the best vector databases of 2026, highlighting technical updates like pgvectorscale's StreamingDiskANN, Qdrant's Gridstore, and Pinecone's Dedicated Read Nodes.",
    "hero_image": "assets/hero.jpg"
  },
  {
    "id": "2026-06-03-top-12-ai-developer-tools-2026",
    "title": "Top 12 AI Developer Tools in 2026: Coding Assistants, Agents & Security Tools",
    "slug": "top-12-ai-developer-tools-2026",
    "created_at": "2026-06-03T07:34:45.278834+00:00",
    "author": "AI Dev Digest",
    "tags": [
      "AI Tools",
      "DevSecOps",
      "AI Agents",
      "Software Engineering"
    ],
    "excerpt": "Explore the top 12 AI developer tools of 2026, analyzing the latest advancements in AI-native IDEs, autonomous coding agents, and AI-driven security platforms.",
    "hero_image": "assets/hero.jpg"
  },
  {
    "id": "2026-06-03-ai-velocity-paradox-devops-maturity-2026",
    "title": "The AI Velocity Paradox: Why DevOps Maturity Is the Real Bottleneck in 2026",
    "slug": "ai-velocity-paradox-devops-maturity-2026",
    "created_at": "2026-06-03T06:50:35.837400+00:00",
    "author": "AI Dev Digest",
    "tags": [
      "DevOps",
      "AI Coding",
      "Platform Engineering",
      "Software Delivery"
    ],
    "excerpt": "Harness’s latest State of DevOps report reveals how high-speed AI code generation is causing deployment instability and developer burnout, forcing a shift to automated delivery pipelines.",
    "hero_image": "assets/hero.jpg"
  },
  {
    "id": "2026-06-03-best-rag-tools-enterprise-ai-2026",
    "title": "7 Best RAG Tools for Enterprise AI Applications in 2026",
    "slug": "best-rag-tools-enterprise-ai-2026",
    "created_at": "2026-06-03T06:19:51.786984+00:00",
    "author": "AI Dev Digest",
    "tags": [
      "RAG",
      "Generative AI",
      "Enterprise Architecture",
      "DevOps"
    ],
    "excerpt": "Discover the 7 essential tools powering agentic, high-precision, and compliance-native RAG architectures in modern enterprise environments.",
    "hero_image": "assets/hero.jpg"
  },
  {
    "id": "2026-06-03-software-development-2026-tools-trends",
    "title": "Software Development in 2026: Navigating AI Agents, Cloud-Native Toolchains, and DevOps Automation",
    "slug": "software-development-2026-tools-trends",
    "created_at": "2026-06-03T04:30:56.074510+00:00",
    "author": "AI Dev Digest",
    "tags": [
      "software-engineering",
      "ai-development",
      "cloud-native",
      "devops",
      "refonte-learning"
    ],
    "excerpt": "Explore how AI-augmented development, agentic workflows, and cloud-native toolchains are transforming the software engineering landscape in 2026.",
    "hero_image": "assets/hero.jpg"
  },
  {
    "id": "2026-06-03-state-of-llms-2025-inference-scaling-long-context",
    "title": "The State of LLMs 2025: From Chat Boxes to Inference-Time Scaling",
    "slug": "state-of-llms-2025-inference-scaling-long-context",
    "created_at": "2026-06-03T03:16:55.543139+00:00",
    "author": "AI Dev Digest",
    "tags": [
      "llm",
      "software-engineering",
      "rag",
      "artificial-intelligence"
    ],
    "excerpt": "A technical breakdown of the major shifts in LLM engineering for 2025: the decline of classical RAG, the rise of inference-time scaling, and local tool-use architectures.",
    "hero_image": "assets/hero.jpg"
  },
  {
    "id": "2026-06-03-dora-2025-state-of-ai-assisted-software-development",
    "title": "The 2025 DORA Report: Why AI is a Mirror, Not a Cure for Bad Architecture",
    "slug": "dora-2025-state-of-ai-assisted-software-development",
    "created_at": "2026-06-03T02:10:16.998461+00:00",
    "author": "AI Dev Digest",
    "tags": [
      "dora-report",
      "ai-assisted-development",
      "platform-engineering",
      "devops"
    ],
    "excerpt": "The inaugural 2025 DORA AI report reveals that AI-assisted development amplifies your team's existing strengths—and exposes its systemic weaknesses.",
    "hero_image": "assets/hero.jpg"
  },
  {
    "id": "2026-06-02-hello-world",
    "title": "Welcome to AI Dev Digest: Your Feed for AI-Assisted Development",
    "slug": "hello-world",
    "created_at": "2026-06-02T02:00:00Z",
    "author": "AI Dev Digest",
    "tags": [
      "meta",
      "AI tools",
      "developer productivity"
    ],
    "excerpt": "AI Dev Digest is a curated news feed for developers tracking the fast-moving world of AI-assisted coding — tools, frameworks, techniques, and what actually ships.",
    "hero_image": "assets/hero.jpg"
  }
]
