{
  "$schema": "../../schemas/meta.schema.json",
  "id": "2026-06-13-prompt-engineering-dead-what-replaced-it",
  "title": "Prompt Engineering Is Mostly Dead in 2026. Here's What Replaced It.",
  "slug": "prompt-engineering-dead-what-replaced-it",
  "created_at": "2026-06-13T03:15:14.245714+00:00",
  "author": "AI Dev Digest",
  "tags": [
    "AI Engineering",
    "DSPy",
    "SkillOpt",
    "Software Development"
  ],
  "excerpt": "Say goodbye to prompt alchemy and manual CoT strings. In 2026, software developers have transitioned to context engineering, declarative programming, and automated text-space optimization.",
  "hero_image": "assets/hero.jpg"
}
