{
  "$schema": "../../schemas/meta.schema.json",
  "id": "2026-06-08-cost-of-vibe-coding-ai-software-stability-crisis",
  "title": "The Cost of Vibe Coding: Why AI Speed is Breaking Our Codebases in 2026",
  "slug": "cost-of-vibe-coding-ai-software-stability-crisis",
  "created_at": "2026-06-08T03:17:50.652676+00:00",
  "author": "AI Dev Digest",
  "tags": [
    "AI-Assisted Development",
    "Software Architecture",
    "Vibe Coding"
  ],
  "excerpt": "AI tools have slashed software development cycles, but code quality, architecture, and production stability are paying the price. Here is what the data shows.",
  "hero_image": "assets/hero.jpg"
}
