{
  "$schema": "../../schemas/meta.schema.json",
  "id": "2026-06-03-top-12-ai-developer-tools-2026",
  "title": "Top 12 AI Developer Tools in 2026: Coding Assistants, Agents & Security Tools",
  "slug": "top-12-ai-developer-tools-2026",
  "created_at": "2026-06-03T07:34:45.278834+00:00",
  "author": "AI Dev Digest",
  "tags": [
    "AI Tools",
    "DevSecOps",
    "AI Agents",
    "Software Engineering"
  ],
  "excerpt": "Explore the top 12 AI developer tools of 2026, analyzing the latest advancements in AI-native IDEs, autonomous coding agents, and AI-driven security platforms.",
  "hero_image": "assets/hero.jpg"
}
