{
  "$schema": "../../schemas/meta.schema.json",
  "id": "2026-06-09-inside-infoq-at-20-technology-adoption-curve",
  "title": "Inside InfoQ at 20: Navigating the Technology Adoption Curve",
  "slug": "inside-infoq-at-20-technology-adoption-curve",
  "created_at": "2026-06-09T03:15:18.181172+00:00",
  "author": "AI Dev Digest",
  "tags": [
    "Software Architecture",
    "Platform Engineering",
    "AI Engineering",
    "Distributed Systems"
  ],
  "excerpt": "Celebrating 20 years of practitioner-driven engineering insights, we analyze InfoQ's latest architectural patterns for IDPs, distributed resilience, and the AI-agent stack.",
  "hero_image": "assets/hero.jpg"
}
