{
  "$schema": "../../schemas/meta.schema.json",
  "id": "2026-06-06-how-to-fine-tune-llms-2026-costs-gpus-code",
  "title": "How to Fine-Tune LLMs in 2026: Costs, GPUs, and Code",
  "slug": "how-to-fine-tune-llms-2026-costs-gpus-code",
  "created_at": "2026-06-06T05:34:08.547154+00:00",
  "author": "AI Dev Digest",
  "tags": [
    "LLM",
    "Fine-Tuning",
    "GPU",
    "Machine-Learning"
  ],
  "excerpt": "A developer's guide to the 2026 fine-tuning landscape. Explore how to leverage GRPO, Blackwell's cost cascade, and modern Triton kernels to train MoEs on a budget.",
  "hero_image": "assets/hero.jpg"
}
